{
  "$schema": "https://json-schema.org/draft/2020-12/schema",
  "$id": "https://yukh.dev/coordination/schema/diagnostic-0.1.schema.json",
  "title": "Deterministic projection diagnostic 0.1",
  "$comment": "Semantic validator MUST derive primary_id and sequence exactly per RFC-0001; JSON Schema 2020-12 cannot express sibling equality, minima, or trigger history.",
  "type": "object",
  "additionalProperties": false,
  "maxProperties": 8,
  "required": ["sequence", "code", "severity", "primary_id"],
  "properties": {
    "sequence": { "type": "integer", "minimum": 1, "maximum": 9007199254740991 },
    "code": { "enum": ["CLAIM_CONFLICT", "HANDOFF_ACCEPTED_UNCLAIMED", "INCOMPLETE_TRANSCRIPT", "NON_ACTIVE_TRANSCRIPT"] },
    "severity": { "enum": ["warning", "error"] },
    "primary_id": { "type": "string", "minLength": 1, "maxLength": 256 },
    "event_id": { "$ref": "envelope-0.1.schema.json#/$defs/uuidv7" },
    "claim_id": { "$ref": "envelope-0.1.schema.json#/$defs/uuidv7" },
    "contender_ids": { "type": "array", "minItems": 2, "maxItems": 32, "uniqueItems": true, "items": { "$ref": "envelope-0.1.schema.json#/$defs/uuidv7" } },
    "contender_event_ids": { "type": "array", "minItems": 2, "maxItems": 32, "uniqueItems": true, "items": { "$ref": "envelope-0.1.schema.json#/$defs/uuidv7" } }
  },
  "allOf": [
    { "if": { "properties": { "code": { "const": "CLAIM_CONFLICT" } }, "required": ["code"] }, "then": { "properties": { "severity": { "const": "warning" }, "primary_id": { "$ref": "envelope-0.1.schema.json#/$defs/uuidv7" } }, "required": ["contender_ids", "contender_event_ids"], "not": { "anyOf": [{ "required": ["event_id"] }, { "required": ["claim_id"] }] } } },
    { "if": { "properties": { "code": { "const": "HANDOFF_ACCEPTED_UNCLAIMED" } }, "required": ["code"] }, "then": { "properties": { "severity": { "const": "warning" }, "primary_id": { "$ref": "envelope-0.1.schema.json#/$defs/uuidv7" } }, "required": ["event_id", "claim_id"], "not": { "anyOf": [{ "required": ["contender_ids"] }, { "required": ["contender_event_ids"] }] } } },
    { "if": { "properties": { "code": { "enum": ["INCOMPLETE_TRANSCRIPT", "NON_ACTIVE_TRANSCRIPT"] } }, "required": ["code"] }, "then": { "properties": { "severity": { "const": "error" }, "primary_id": { "type": "string", "pattern": "^[0-9a-f]{8}-[0-9a-f]{4}-5[0-9a-f]{3}-[89ab][0-9a-f]{3}-[0-9a-f]{12}$" } }, "not": { "anyOf": [{ "required": ["event_id"] }, { "required": ["claim_id"] }, { "required": ["contender_ids"] }, { "required": ["contender_event_ids"] }] } } }
  ]
}
